{
  "$schema": "https://jonibach.github.io/rulecad/schemas/object.schema.json",
  "name": "module",
  "title": "Thin RP2040 module",
  "version": "0.3.0",
  "engine": "pcb",
  "role": "board",
  "uses": [
    "sea_picro",
    "jlcpcb",
    "rp2040"
  ],
  "orientation": "A circuit board, made by a fab (JLCPCB), not printed. Seen from above: USB-C on the top long edge, castellated pins along the bottom edge and up both ends. Parts on the front, test points on the back.",
  "parts": {
    "board": {
      "label": "PCB"
    }
  },
  "variables": {
    "edge_pins": {
      "value": 17,
      "unit": "pins",
      "rule": "Pins along the bottom long edge, between the corners",
      "label": "Long-edge pins",
      "show": true,
      "interface": true
    },
    "end_pins": {
      "value": 7,
      "unit": "pins",
      "rule": "Pins up each short end, from the bottom edge (Sea-Picro has 31 edge pins: edge_pins + 2 × end_pins)",
      "label": "End pins",
      "show": true,
      "interface": true
    },
    "end_rise": {
      "value": 1.59,
      "unit": "mm",
      "rule": "Each end's lowest pin this far above the bottom edge: down at the corner, beside the long edge's first pin, as on Waveshare's RP2040-Zero (1.59 mm there)"
    },
    "row_in": {
      "value": 3.92,
      "unit": "mm",
      "rule": "The long edge's first and last pins this far in from the ends, clear of the corner pins and their header pads, as on Waveshare's RP2040-Zero (3.92 mm there)"
    },
    "pitch": {
      "value": 2.54,
      "unit": "mm",
      "rule": "Pin pitch: 0.1 in headers, as Sea-Picro's",
      "interface": true
    },
    "headers": {
      "value": 1,
      "rule": "1: each pin also has Sea-Picro's 0.1 in header hole and long pad beside its half hole, for pin headers or a sturdier joint. 0: half holes only, to solder flat: they reach less far into the board, which then needs less room across",
      "label": "Header holes",
      "show": true,
      "interface": true,
      "unit": "0 or 1"
    },
    "length": {
      "value": "(edge_pins - 1) * pitch + 2 * row_in",
      "unit": "mm",
      "rule": "Board length: the long-edge pins one pitch apart, row_in from each end",
      "label": "Length",
      "show": true,
      "interface": true
    },
    "height": {
      "value": "19.04 + 2 * headers",
      "unit": "mm",
      "rule": "Board height, bottom edge to top edge: the room the core and the tracks round it need (2 mm more with header holes, whose pads reach farther in)",
      "label": "Height",
      "show": true,
      "interface": true
    },
    "core_turn": {
      "value": 90,
      "unit": "°",
      "rule": "Sea-Picro's core (the RP2040, flash, crystal, regulator and their small parts) turned as one block: its busiest side of escapes (RP2040 pins 2 to 12) faces the long row of pins"
    },
    "core_x": {
      "value": -9.77,
      "unit": "mm",
      "rule": "The core block moved along the board: a channel from the end pins for tracks to pass"
    },
    "core_y": {
      "value": "1.31 * headers - 0.85",
      "unit": "mm",
      "rule": "The core block moved across the board: clear of the bottom pins (higher with header holes, which reach farther in), with room above it for tracks"
    },
    "usb_x": {
      "value": 14.3,
      "unit": "mm",
      "rule": "USB-C socket along the top edge, from the middle: right of the core, its fuse and CC resistors under it",
      "label": "USB-C position",
      "show": true,
      "interface": true
    },
    "usb_out": {
      "value": 0.9,
      "unit": "mm",
      "rule": "The mid-mount socket's centre beyond the top edge, as on Sea-Picro"
    },
    "notch_below": {
      "value": 0.5,
      "unit": "mm",
      "rule": "Reading Sea-Picro's notch: outline points this far below its top edge are the notch's"
    },
    "notch_reach": {
      "value": 6,
      "unit": "mm",
      "rule": "Reading Sea-Picro's notch: outline points this near the socket, across the board"
    },
    "led_x": {
      "value": 14.3,
      "unit": "mm",
      "rule": "Pad 32 (LED_5V, a 5 V supply for LEDs) under the USB parts"
    },
    "led_y": {
      "value": -3.6,
      "unit": "mm",
      "rule": "Pad 32's height on the board"
    },
    "switch_in": {
      "value": "1.4 * headers + 2.4",
      "unit": "mm",
      "rule": "R4 (SWITCH's resistor) in from its pin's castellated hole: clear of the header pad if there is one, within its placement rule"
    },
    "switch_turn": {
      "value": 90,
      "unit": "°",
      "rule": "R4 turned to lie across the board when its pin is on the long edge"
    },
    "thickness": {
      "value": "sea_picro.thickness",
      "unit": "mm",
      "rule": "Board thickness, as Sea-Picro's"
    },
    "layers": {
      "value": "sea_picro.layers",
      "rule": "Copper layers, as Sea-Picro's: tracks outside, GND and 3.3 V planes inside"
    },
    "track": {
      "value": 0.15,
      "unit": "mm",
      "rule": "Signal track width: over JLCPCB's minimum, as Sea-Picro's fine tracks"
    },
    "clearance": {
      "value": 0.15,
      "unit": "mm",
      "rule": "Copper to copper, kept by the router: Sea-Picro's own clearance (at JLCPCB's 0.1 mm the router packs tracks tighter and breaks more)"
    },
    "label_gap": {
      "value": 0.3,
      "unit": "mm",
      "rule": "Pin labels: from the end of the header pad to the label"
    },
    "label_char": {
      "value": 0.75,
      "rule": "Pin labels: a character's width, as a share of its height (tscircuit's font)"
    },
    "label_turn": {
      "value": 90,
      "unit": "°",
      "rule": "Pin labels along the long edge turned to run up from their pins"
    }
  }
}
